{"canvas_digest":"sha256:d70b55dd2d76d51b834c73c3709efa1cc4b35f323c1057867fce33ce0495bdcc","chain_scope":{"chain":"kaspa","network":"kaspa-testnet-11","schema_version":1},"code_confirmation_digest":"sha256:734f728ea975f45be8468598701223ec74793d3603a7440065abe6641a4b9025","content_digest":"sha256:4de3cf2c70f22601d0399b50c7b82f128525099c9886f76989df07f3084d9ec5","created_at":"2026-09-01T00:00:00.000Z","expires_at":"2026-09-01T02:00:00.000Z","proposal_id":"proposal:sha256:85444d9af2bd0e663a5ebec2c7336b83f8186809f365f7726b2501fa5fa77b6b","readiness":{"blockers":[],"status":"ready_for_wallet_review"},"schema":"covhub.wallet-proposal/v1","summary":"Unsigned Kaspa transaction material for independent wallet review.","transaction":{"encoding":"base64","material_base64":"Y292aHViLWdvbGRlbi10cmFuc2FjdGlvbi1tYXRlcmlhbA==","media_type":"application/vnd.kaspa.transaction-review+binary","sha256":"sha256:0d4444ffd470eef55102e241053784edab89cc82a18883085a139540395486da"}}
